<?xml version="1.0" encoding="UTF-8"?>
<config xmlns="https://github.com/srchen1987/dawdler-series"
	xmlns:xsi="http://www.w3.org/2001/XMLSchema-instance"
	xsi:schemaLocation="https://github.com/srchen1987/dawdler-series https://cdn.jsdelivr.net/gh/srchen1987/dawdler-series-xsd@main/server-conf.xsd">
	<keyStore
		keyStorePath="dawdler.keystore" alias="srchen"
		password="jackson.song1948@anywide" />
	<server host="0.0.0.0" tcp-port="9527"
		shutdownWhiteList="127.0.0.1,localhost" tcp-shutdownPort="19930"
		tcp-backlog="200" tcp-sendBuffer="163840" tcp-receiveBuffer="163840"
		tcp-keepAlive="false" tcp-noDelay="false" />
	<global-auth>
		<user username="global_user" password="global_password" />
		<user username="global_user_1" password="global_password" />
	</global-auth>
	<!-- 全局通用的用户，可以通用在任意本服务的模块中 第一行为账号 第二行为密码 -->
	<module-auth>
		<module name="user-service">
			<user username="user1" password="user1password" />
			<user username="user2" password="user2password" />
		</module>
		<module name="order-service">
			<user username="order_user1" password="user1password" />
		</module>
	</module-auth><!--
	模块下的用户，只能调用指定模块 第一行为账号 第二行为密码 -->

	<health-check check="off" scheme="http" port="19001"
		backlog="0" username="jackson" password="pttl123">
		<elasticSearch check="on" />
		<jedis check="on" />
		<rabbit check="on" />
		<dataSource check="on" />
		<config check="on" />
		<consul check="on" />
		<zookeeper check="on" />
	</health-check>

</config>
